{
  "task_id": "t",
  "verdict": "request_changes",
  "head_sha": "aaaaaaaaaaaaaaaaaaaaaaaaaaaaaaaaaaaaaaaa",
  "checks_run": [
    {
      "command": "pnpm test",
      "exit_code": 1,
      "summary": "fail"
    }
  ],
  "findings": [
    {
      "id": "F1",
      "severity": "Important",
      "file": "a.mjs",
      "line": 3,
      "claim": "bug",
      "expected": "no bug",
      "evidence": {
        "kind": "command",
        "ref": "pnpm test",
        "observed": "fail"
      }
    }
  ]
}
